81,excise duty,They are pressing the Chancellor to reduce excise duty on beer.,"Duty Free products , those such as cigarettes and some spirits which are exempt of excise duty and taxes , are only available to customers travelling outside the EU.",消费税,他们正给总理施压，要求降低啤酒的消费税。,免税商品，比如免征消费税和其他税种的香烟和一些烈酒，只面向飞往欧盟以外目的地的消费者。
82,family trust,In 2012 he transferred Richard 's stake in the family trust to Victor and named the latter as his successor.,"He claimed he and his family trust paid $ 44m to Gerhard Gribkowsky , a former executive of the state-backed bank BayernLB to stop him giving information about Mr Ecclestone 's financial affairs to tax authorities.",家庭信托基金,2012年，李嘉诚把李泽楷在家族信托中的份额转移至李泽钜名下，并指定李泽钜为他的继承人。,他声称，他和他的家族信托曾向州立的巴伐利亚银行（BayernLB）前高管格哈德•格里布科夫斯基（GerhardGribkowsky）支付4400万美元，以阻止他向税收当局透露埃克尔斯通的财务信息。
83,franchise,"Zoella and the rest of the "" Brit crew "" may be relative novices at stardom , but they have a keen sense of the value of their franchise.",That fast food business have expanded through the sale of franchise.,特许经销权,佐拉和其他“英国帮”的成员可能相对是明星新秀，但是他们对自己特许经销权的价值有着高度敏锐性。,该快餐店通过出售特许经销权而扩大了生意。
84,fraud,This is not the first time he has been investigated by the police for fraud.,Her involvement in the fraud has left a serious blot on her character.,欺诈,这不是警方第一次调查他是否有欺诈行为。,她卷入了这次欺诈案，在她的品格上留下了一个很大的污点。
85,joint ownership,"Voice 3 : "" I want joint ownership of these lands now . My son may sell the land . I want security .""",Research on Realization of Digital Watermarking for JointOwnership,共同所有权,声音3：“现在我想共同拥有这些土地。我的儿子可能会将这片地卖掉。我需要保障。”,联合数字水印实现技术研究
86,,,,,,
87,scam,"If the scheme appears to be a pyramid selling scam , have nothing to do with it.",Their scam was selling fake Chinese medicine to old people.,骗局,如果这个计划看起来像是一个传销骗局，那就不要参与。,他们的骗局是卖假中药给老人。
88,securities,Short-term securities can also be held as part of an investment portfolio.,Its shares are traded on the Unlisted Securities Market.,证券,投资组合里也可以包括短期有价证券。,那家公司的股票在场外证券市场交易。
89,stamp duty,Slashing the stamp duty - the tax charged on stock trading - would be another clear signal that policy makers are looking to turn things around.,"The move to increase stamp duty surcharges for foreigners to 7 per cent from July 1 , up from 3 per cent , comes as New Zealand considers a land tax on foreigners.",印花税,此外，中国政府还可以下调印花税，这是另外一个决策者寻求扭转局面的明确信号。,维多利亚州决定，从今年7月1日起，外国人购房需缴纳的额外印花税的税率将从3%提高到7%。与此同时，新西兰也在考虑对外国购房者征收土地税。
90,trademark,' Big Mac ' is McDonald 's best-known trademark.,Ford allowed the name and trademark to lapse during the Eighties.,商标,“巨无霸”是麦当劳最著名的商标。,福特在20世纪80年代废止了该名称和商标。
91,trust account,Comes in every Friday to pull cash out of his trust account.,I went to the bank and opened up a new trust account for you--,信托账户,他每个星期五都会来，把钱从他的信托帐户取走。,我去银行给你开了个新的信托账户
92,cover note,"It works like this . While the policy is being prepared , the broker sends us a cover note.",A cover note is a form of interim insurance that covers the insured for a short length of time.,封面说明,是这样的。当在起草保险条款时，经纪人给我们一份保险通知。,承保通知书是为投保人在短时间内提供保险的一种临时性保单。
93,duty of disclosure,The duty of disclosure is an important part of the insurance system.,Study of Several Questions on the Duty of Disclosure inInsurance,告知义务,如实告知义务制度是保险制度中的重要一环。,保险告知义务若干问题研究
94,excess,Scientists say the excess heavy nitrogen could have come from a comet.,The fat boy went on a diet to get rid of his excess weight.,过量的,科学家认为过量的重氮来自彗星。,这个胖男孩节制饮食以减轻过量的体重。
95,professional indemnity,They were charged with failing to have professional indemnitycover,Study on Professional Indemnity Insurance for EngineeringProfession,专业损害赔偿,他们被指控未能提供职业保险保障。,建设工程相关职业责任保险研究
96,public liability insurance,The Research and Countermeasures to the Fire Public Liability Insurance inChina,"Well , there 's Public Liability insurance.",公众责任保险,我国火灾公众责任保险现状研究及对策,还有公共责任险。
97,replacement policy,"Based on the analysis of Web traces , we present an adaptive replacement policy.","Secondly , design and realize a segment-based caching replacement policy.",更换政策,在分析轨迹文件的基础上，提出了自适应缓存替换策略&最少正规化费用替换算法（LNC）。,设计并实现了一个基于节目分段缓存的缓存接纳控制和缓存替换策略。
98,surrender value,Cash surrender value of lifeinsurance,What is the surrender value of these shares?,退保价值,人寿保险的现金退保值,这些股票的转让价额是多少？
